{
  "codec": "H265",
  "profile": "main10",
  "level": "5.1",
  "preset": "slower",
  "tune": "ssim",
  "bit_depth": 10,
  "chroma_subsampling": "4:2:0",
  "color_primaries": "BT.709",
  "transfer_characteristics": "BT.709",
  "matrix_coeffs": "BT.709",
  "framerate": 59.94,
  "gop_size": 120,
  "b_frames": 4,
  "ref_frames": 4,
  "intra_refresh": true,
  "open_gop": false,
  "rc_mode": "vbr",
  "bitrate_kbps": 8000,
  "max_bitrate_kbps": 12000,
  "vbv_buf_ms": 500,
  "vbv_init_pct": 90,
  "aq_mode": "variance",
  "aq_strength": 1.0,
  "psy_rd": 1.0,
  "me_method": "hex",
  "me_range": 32,
  "sc_detection": true,
  "min_qp": 12,
  "max_qp": 42,
  "qp_i": 22,
  "qp_p": 24,
  "qp_b": 26,
  "hdr_mode": "off",
  "sar_num": 1,
  "sar_den": 1,
  "timecode": "00:00:00:00",
  "timestamp_mode": "dts",
  "svc_layers": 1
}